{
  "$schema": "./slo-policy.schema.json",
  "schema_version": "belacca.slo-policy.v1",
  "policy_id": "belacca-slo-99-v1",
  "status": "approved-initial-policy",
  "owner": "platform",
  "review_cadence": "monthly and after every material incident, target change, or measurement-source change",
  "target": {
    "availability": 0.99,
    "target_percent": "99%",
    "window": "rolling 30d",
    "window_hours": 720,
    "observation_cadence": "1h",
    "error_budget_bad_slots": 7.2,
    "claim_rule": "Publish the measured level immediately as good observed slots divided by good plus bad observed slots; use the latest rolling 720-slot window once the evidence spans 30 days, with coverage and unknown slots shown alongside it."
  },
  "non_sla": "This is an internal engineering objective. It is not an SLA, warranty, customer promise, service-credit commitment, or compensation obligation.",
  "measurement": {
    "source_repository": "macel94/belacca-status",
    "source_artifact": "slo.json",
    "source_history_schema": "belacca.observation.v1",
    "source_kind": "external-durable-synthetic-probe",
    "attempt_policy": "The source may retry each check up to three times; a slot is bad only after the source's configured attempts fail.",
    "denominator": "Before the evidence spans 30 days, use good observed slots divided by good plus bad observed slots; thereafter use the latest rolling 720-slot window. The expected 720 slots remain visible as coverage context.",
    "unknown_policy": "Unknown slots never count as good or bad. Missing, malformed, duplicate/ambiguous, stale, or incomplete component evidence remains visible in coverage and cannot improve the measured level. A recorded failed journey remains bad; it is not changed to unknown because the result is inconvenient.",
    "window_policy": "Use available observed history until it spans 30 days, then use the latest rolling 720-slot window. Do not backfill, reinterpret, or declare 99% from a status-page response, native metrics, or incomplete coverage."
  },
  "services": [
    {
      "id": "portfolio",
      "name": "Francesco Belacca portfolio",
      "scope": "public",
      "slo_status": "proposed",
      "target_percent": "99%",
      "window": "rolling 30d",
      "observation_cadence": "1h",
      "error_budget_bad_slots": 7.2,
      "owner": "platform",
      "public_hosts": [
        "francesco.belacca.com",
        "belacca.com",
        "www.belacca.com",
        "www.francesco.belacca.com"
      ],
      "measurement_source": "macel94/belacca-status:slo.json (hourly external durable synthetic history)",
      "native_production_implementation": "macel94/belacca-gitops:clusters/belacca-production/native-applications.yaml (source: macel94/francesco-belacca-site:deploy)",
      "journey": "Fetch the canonical portfolio HTTPS /health endpoint and homepage from outside native production; aliases are routing diagnostics and do not create extra SLO denominators.",
      "numerator": "Hourly slots where /health returns the expected HTTP 200/ok result and the canonical homepage returns the expected successful portfolio response.",
      "denominator": "Good observed slots divided by good plus bad observed slots until the evidence spans 30 days; thereafter the latest rolling 720 hourly slots, with unknown coverage shown separately.",
      "good_observation": "The complete portfolio health and homepage journey passes after the source retry policy.",
      "bad_observation": "A valid hourly observation exists, but one or more critical portfolio health/homepage checks fail after retries.",
      "unknown_observation": "The hourly slot is absent, malformed, stale, duplicated ambiguously, missing a required component, or otherwise cannot be classified from sanitized evidence.",
      "review_cadence": "Monthly; after a bad-budget threshold, incident, probe/schema change, or production routing change.",
      "runbook": "macel94/belacca-gitops:docs/RELIABILITY.md#portfolio"
    },
    {
      "id": "pong",
      "name": "Cloud Native Pong",
      "scope": "public",
      "slo_status": "proposed",
      "target_percent": "99%",
      "window": "rolling 30d",
      "observation_cadence": "1h",
      "error_budget_bad_slots": 7.2,
      "owner": "platform",
      "public_hosts": ["pong.belacca.com"],
      "measurement_source": "macel94/belacca-status:slo.json (hourly external durable synthetic history using macel94/cloudnativepong:scripts/synthetic-check.mjs)",
      "native_production_implementation": "macel94/belacca-gitops:clusters/belacca-production/native-applications.yaml, Kustomization path ./k8s/overlays/native-staging (live native-production compatibility path), sourced from macel94/cloudnativepong",
      "journey": "Fetch the public homepage and health endpoint, create and join a room, establish two unique WebSocket-compatible players, observe playing state, and observe cleanup after disconnect.",
      "numerator": "Hourly slots where every critical homepage, health, room create/join, player assignment, playing-state, and cleanup stage passes.",
      "denominator": "Good observed slots divided by good plus bad observed slots until the evidence spans 30 days; thereafter the latest rolling 720 hourly slots, with unknown coverage shown separately.",
      "good_observation": "The complete public Pong journey passes after the source retry policy, including cleanup; native WebTransport is optional and is not silently substituted for the WebSocket-compatible path.",
      "bad_observation": "A valid hourly observation exists, but any critical Pong journey stage fails after retries.",
      "unknown_observation": "The hourly slot is absent, malformed, stale, duplicated ambiguously, missing a required stage, or otherwise cannot be classified from sanitized evidence.",
      "review_cadence": "Monthly; after a bad-budget threshold, incident, synthetic-contract change, release-path change, or production routing change.",
      "runbook": "macel94/belacca-gitops:docs/RELIABILITY.md#pong"
    },
    {
      "id": "analytics",
      "name": "GoatCounter analytics",
      "scope": "public",
      "slo_status": "proposed",
      "target_percent": "99%",
      "window": "rolling 30d",
      "observation_cadence": "1h",
      "error_budget_bad_slots": 7.2,
      "owner": "platform",
      "public_hosts": ["stats.belacca.com"],
      "measurement_source": "macel94/belacca-status:slo.json (hourly external durable synthetic history)",
      "native_production_implementation": "macel94/belacca-gitops:clusters/belacca-production/analytics",
      "journey": "Fetch public /status and make the fixed harmless same-origin /count collector request; /count.js is a supporting diagnostic, not a separate SLO denominator.",
      "numerator": "Hourly slots where /status succeeds and the harmless /count collector probe succeeds.",
      "denominator": "Good observed slots divided by good plus bad observed slots until the evidence spans 30 days; thereafter the latest rolling 720 hourly slots, with unknown coverage shown separately.",
      "good_observation": "The analytics status and harmless collector journey passes after the source retry policy.",
      "bad_observation": "A valid hourly observation exists, but /status or /count fails after retries.",
      "unknown_observation": "The hourly slot is absent, malformed, stale, duplicated ambiguously, missing a required component, or otherwise cannot be classified from sanitized evidence.",
      "review_cadence": "Monthly; after a bad-budget threshold, incident, probe/schema change, or production routing/storage change.",
      "runbook": "macel94/belacca-gitops:docs/RELIABILITY.md#analytics"
    },
    {
      "id": "operator-surfaces",
      "name": "Protected operator surfaces",
      "scope": "protected-operator",
      "slo_status": "not_configured",
      "target_percent": "99%",
      "window": "rolling 30d",
      "observation_cadence": "1h",
      "error_budget_bad_slots": 7.2,
      "enabled": false,
      "owner": "platform",
      "public_hosts": ["dashboard.belacca.com", "flux.belacca.com", "dex.belacca.com"],
      "measurement_source": null,
      "native_production_implementation": "macel94/belacca-gitops:clusters/belacca-production/headlamp, flux-web, dex, and routing/platform-ingress.yaml",
      "journey": "Conditional objective only: an operator-managed external probe must authenticate through the approved identity path and verify the intended dashboard or Flux user journey; a redirect-only response is not success.",
      "numerator": "Conditional: authenticated hourly operator-journey slots that complete the approved path.",
      "denominator": "Conditional: all 720 expected hourly authenticated probe slots after an approved measurement path exists.",
      "good_observation": "Conditional: the authenticated probe completes the approved operator journey without storing credentials, tokens, or private response data.",
      "bad_observation": "Conditional: an authenticated probe slot is valid but the approved operator journey fails.",
      "unknown_observation": "No approved authenticated path exists, credentials are unavailable, the slot is absent/malformed/stale/ambiguous, or authentication cannot be safely verified.",
      "activation_rule": "Do not activate or claim this separate 99%/30d objective until an authenticated external measurement path, owner, secret-handling design, privacy review, alert routing, and runtime validation are approved. Until then it is not part of public or portfolio SLO claims.",
      "review_cadence": "At activation and monthly thereafter; immediately after identity, route, or access-policy changes.",
      "runbook": "macel94/belacca-gitops:docs/RELIABILITY.md#dashboard"
    }
  ],
  "error_budget_policy": {